{
  "kind": "github-actions-ci", "identity": "louke.contract.v0.14-002.github-actions-ci", "revision": "prism-round-3-remediation-candidate",
  "schema_ref": {"identity": "louke.machine-contract.github-actions-ci", "version": "1.0.0", "digest": "sha256:6522165ad69c7753be34465a9acac3a5a4dbce446a1dfaffcd8ef4012cf87111"},
  "manifest_ref": {"identity": "louke.design-artifacts.v0.14-002.prism-r3-remediation", "revision": "prism-round-3-remediation-candidate"},
  "scope": {"workspace_id": "github.com/zillionare/louke", "spec_id": "v0.14-002-workflow-reflow-design", "base_commit": "2734177ef5398e4c10a1f68039ec469ccc21f2b8", "project_facts_digest": "sha256:4b1a523c1cf946b480162e5321d3c92aeebdea75f57d5768948aee6f76672130", "project_facts_artifact": {"kind": "host-project-facts-snapshot", "path": "design-artifacts/inputs/host-project-facts.snapshot.json", "identity": "louke.host-project-facts.github.com-zillionare-louke", "revision": "base-2734177-workspace-2026-07-20-r2"}, "release_identity": "0.14.0"},
  "generated_by": {"owner": "Runtime/program", "role": "Archer", "task_manifest_digest": "sha256:0a9d58474340e9520af49d2bea462c41533c1fabc81afbcf4f5f292caecefbfc", "task_manifest_artifact": {"kind": "archer-author-task-manifest", "path": "design-artifacts/inputs/archer-author-task-manifest.candidate.json", "identity": "runtime.v0.14-002.m-design.archer.prism-r3-remediation", "revision": "prism-round-3-remediation-candidate"}}, "compatible_runtime": ">=0.14.0,<0.15.0",
  "artifact_refs": [
    {"path": ".louke/project/specs/v0.14-002-workflow-reflow-design/test-plan.md", "digest": "sha256:02a928e09f4abc80ae6ec0c60ec39ba33a131cfd5acc47dc3daeeab97cb4d53e", "ac_ids": ["AC-FR0100-01","AC-FR0200-01","AC-FR0300-01","AC-FR0400-01","AC-FR0500-01","AC-FR0600-01","AC-FR0700-01","AC-FR0800-01","AC-FR0900-01","AC-FR1000-01","AC-FR1100-01","AC-FR1200-01","AC-FR1300-01","AC-FR1400-01","AC-FR1500-01","AC-FR1600-01","AC-FR1700-01","AC-FR1800-01","AC-FR1900-01","AC-FR2000-01","AC-FR2050-01","AC-FR2100-01","AC-FR2200-01","AC-FR2300-01","AC-FR2400-01","AC-FR2500-01","AC-FR2600-01","AC-FR2700-01","AC-NFR0100-01","AC-NFR0200-01","AC-NFR0300-01","AC-NFR0400-01","AC-NFR0500-01","AC-NFR0600-01"], "interface_ids": ["IF-DES-01","IF-DES-02","IF-CON-01","IF-REG-01","IF-TST-01","IF-PC-01","IF-CI-01","IF-REL-01","IF-BLD-01","IF-PUB-01","IF-PRM-01","IF-REV-01","IF-WEB-01","IF-FCT-01","IF-AUD-01"], "architecture_anchors": ["ARC-WEB","ARC-DESIGN","ARC-FACTS","ARC-REGISTRY","ARC-CONTRACTS","ARC-VALIDATE","ARC-PROMPTS","ARC-CI","ARC-PRECOMMIT","ARC-VERSION","ARC-BUILD","ARC-PUBLISH","ARC-REVIEW","ARC-STORE","ARC-MIGRATION","ARC-SECURITY"], "contract_kind": "github-actions-ci"},
    {"path": ".louke/project/specs/v0.14-002-workflow-reflow-design/interfaces.md", "digest": "sha256:ce4e83ae0d0f614a43a1912e317859105f84f08ba53fc3e8b1cc150dd108e37f", "ac_ids": ["AC-FR1100-01","AC-FR1200-01","AC-FR1300-01"], "interface_ids": ["IF-CI-01"], "architecture_anchors": ["ARC-CI","ARC-STORE","ARC-PUBLISH","ARC-SECURITY"], "contract_kind": "github-actions-ci"},
    {"path": ".louke/project/specs/v0.14-002-workflow-reflow-design/architecture.md", "digest": "sha256:32c88eb2062eb0173738086202eddf87122204ee99d32133c1ea30a6c39335cc", "ac_ids": ["AC-FR1100-01","AC-FR1200-01","AC-FR1300-01"], "interface_ids": ["IF-CI-01"], "architecture_anchors": ["ARC-CI","ARC-SECURITY"], "contract_kind": "github-actions-ci"}
  ],
  "payload": {
    "commands": [
    {"id": "quality", "cwd": ".", "command": "pre-commit run --all-files && python -m mypy louke", "implementation_state": "existing", "success": "all fast quality checks 0 and no unreviewed modification", "failure": "nonzero/timeout/modified/unknown fails"},
    {"id": "unit", "cwd": ".", "command": "python -m pytest -q tests/unit --cov=louke --cov-report=xml --cov-fail-under=95", "implementation_state": "existing", "success": "matrix and coverage pass", "failure": "any matrix/coverage failure fails"},
    {"id": "integration", "cwd": ".", "command": "tests/e2e/run-project-venv integration", "implementation_state": "candidate-change-required", "success": "historical+v014 required evidence pass", "failure": "contract non-success fails"},
    {"id": "e2e", "cwd": ".", "command": "tests/e2e/run-project-venv e2e --profile all --runtime both", "implementation_state": "candidate-change-required", "success": "all required profiles/runtimes/journeys pass", "failure": "contract non-success fails"},
      {"id": "build", "cwd": ".", "command": "python -m build", "implementation_state": "existing", "success": "wheel and sdist built then IF-BLD-01 verified", "failure": "build/artifact/readback mismatch fails"},
      {"id": "artifact-verify", "cwd": ".", "command": "IF-BLD-01 project-local artifact verifier", "implementation_state": "candidate-change-required", "success": "wheel and sdist versions, digests, prompts, schemas and clean-install outlets verified", "failure": "any missing, mismatch or unknown result fails"},
      {"id": "design-contract", "cwd": ".", "command": "python -m louke._tools.design_contract validate --manifest .louke/project/specs/v0.14-002-workflow-reflow-design/design-artifacts/design-artifact-manifest.candidate.json --format json --output design-contract-evidence.json", "implementation_state": "candidate-change-required", "success": "34/15/16/7 closure and all digests current", "failure": "missing/unknown/stale/parity/secret/output failure nonzero"},
      {"id": "ac-trace", "cwd": ".", "command": "python tools/check_ac_traceability.py --acceptance .louke/project/specs/v0.14-002-workflow-reflow-design/acceptance.md --tests tests", "implementation_state": "candidate-change-required", "success": "34/34 AC and every required layer have evidence", "failure": "missing, extra, skipped or unknown trace fails"},
      {"id": "required", "cwd": "GitHub Actions", "command": "if: always() aggregate exact required needs", "implementation_state": "candidate-change-required", "success": "every required need is exactly success", "failure": "failure, cancel, timeout, missing, skip, not-run or unknown fails"}
    ],
    "provider": "github-actions", "managed_path": ".github/workflows/louke-ci.yml", "owner_marker": "louke-managed:v0.14-002", "contract_revision": "prism-round-3-remediation-candidate", "target_branches": ["main","releases/**"], "triggers": ["pull_request","push","workflow_dispatch","release prerequisite"], "runner_matrix": {"default": "ubuntu-22.04", "unit_python": ["3.11","3.12","3.13","3.14"]}, "setup": ["actions/checkout@v4","actions/setup-python@v5","install project/test locked dependencies","install Playwright 1.54.0 Chromium for e2e"],
    "jobs": [
      {"id":"quality","required":true,"command_ref":"quality","needs":[],"timeout_minutes":10,"permissions":"contents: read","evidence":["quality log"]},
      {"id":"design-contract","required":true,"command_ref":"design-contract","needs":["quality"],"timeout_minutes":10,"permissions":"contents: read","evidence":["design-contract-evidence.json"]},
      {"id":"ac-trace","required":true,"command_ref":"ac-trace","needs":["quality"],"timeout_minutes":10,"permissions":"contents: read","evidence":["34/34 closure JSON"]},
      {"id":"build-artifacts","required":true,"command_ref":"build","needs":["quality"],"timeout_minutes":15,"permissions":"contents: read","evidence":["wheel","sdist","build log"]},
      {"id":"artifact-verify","required":true,"command_ref":"artifact-verify","needs":["build-artifacts"],"timeout_minutes":15,"permissions":"contents: read","evidence":["artifact identity JSON"]},
      {"id":"unit","required":true,"command_ref":"unit","needs":["artifact-verify"],"timeout_minutes":20,"permissions":"contents: read","evidence":["JUnit","coverage.xml"]},
      {"id":"integration","required":true,"command_ref":"integration","needs":["artifact-verify"],"timeout_minutes":30,"permissions":"contents: read","evidence":["JUnit","runner evidence"]},
      {"id":"e2e-standin","required":true,"command_ref":"e2e","needs":["artifact-verify"],"timeout_minutes":40,"permissions":"contents: read","evidence":["journey report","Playwright trace on failure"]},
      {"id":"Louke CI / required","required":true,"command_ref":"required","needs":["quality","design-contract","ac-trace","build-artifacts","artifact-verify","unit","integration","e2e-standin"],"timeout_minutes":5,"permissions":"contents: read","evidence":["single stable required check conclusion"]}
    ],